title,ISBN,author,description,link
Свидание в позе лотоса,978-5-17-119142-9,Солнцева Наталья Анатольевна,"Уникальное сочетание мистики и реальности. Необычный рекламный ход владелицы салона ""Лотос"" приводит к мистически-необъяснимым последствиям. Давние обиды и слепая всепоглощающая вера приводят к гибели людей. И все это органически вплетается в сюжет этого удивительного романа. Привидение поселилось в восточном салоне ""Лотос""! Слух о нем всколыхнул мирок скучающих обеспеченных дам. Пошли сплетни, что опасную инсценировку с мнимым привидением придумала сама хозяйка для привлечения клиентов. И ее замысел удался! Заведение стало более чем популярно. Но вскоре одна из сотрудниц салона бесследно исчезает, а придуманный призрак присылает владелице салона предупреждение о новом несчастье – лотос с оторванным лепестком. Хозяйка напугана. Помощница частного детектива Смирнова, Ева посещает это модное заведение. Ей хочется разобраться в этой трагической и загадочной истории и бросить вызов призраку. Хватит ли сил…",https://book24.ru/product/svidanie-v-poze-lotosa-5961149/
Третий после смерти,978-5-17-133296-9,Солнцева Наталья Анатольевна,"Если тебя увлекает жанр мистического детектива, ничего лучшего как романы Солнцевой сложно предложить. Они соответствуют заявленному жанру и отвечают всем требованиям, которые читатель предъявляет к увлекательной  книге. В тихом провинциальном городке зверски убит офицер Вершинин. Оказалось, накакуне смерти он повздорил с поклонником своей бывшей возлюбленной Марии Симанской. Скромная учительница музыки обладает необъяснимой женской притягательностью: у нее множество воздыхателей, но никому она не отвечает взаимностью. Вскоре Маша уезжает из родного города, но на этом ее несчастья не закончились... Тем временем в столице происходит еще одно убийство: погиб известный предприниматель. Частный детектив Смирнов и его помощница Ева чувствуют, что надо спешить, иначе будет третий погибший. Каким образом древняя семейная легенда Симанских связана с этими загадочными преступлениями?",https://book24.ru/product/tretiy-posle-smerti-5954822/
Аромат колдовской свечи. Калинина Н.,978-5-517-03410-6,Калинина Н.,"Зажигая восковую свечу, молодая журналистка Ника Болдырева не знала, что этой ночью окажется всего лишь на волосок от смерти. Один за другим, почти на ее глазах, погибают люди. Чтобы разорвать цепь трагических событий и разобраться, что же все-таки происходит, Нике придется спуститься в самый ад и узнать ужасную тайну - ту, что скрывает в себе колдовская свеча.",https://book24.ru/product/aromat-koldovskoy-svechi-kalinina-n-5960942/
Девушка на крыльце,978-1-913138-67-7,Чизмар Ричард,"Семью Такер можно без тени сомнения назвать счастливой. Сара присматривает за домом, сплетничает с подругами и выращивает овощи на грядке, а ее муж Кенни, учитель английского и футбольный тренер по совместительству, любит играть с друзьями в карты. Вместе с дочерью Натали они живут в небольшом американском городе в окружении доброжелательных соседей.   Идиллия провинциальной жизни рушится, когда однажды ночью на их крыльце появляется незнакомая девушка, и уютный городок постепенно начинает поддаваться натиску все возрастающей паранойи.",https://book24.ru/product/devushka-na-kryltse-5952526/
Проклятье музыканта. Калинина Н.Д.,978-5-517-03233-1,Калинина Н.,"Покупая любимому мужу старинную гитару, Анна не подозревала, что вносит в дом зло. С инструментом связано древнее проклятье, и все владельцы гитары погибают. Раулю и самой Анне грозит нешуточная опасность.",https://book24.ru/product/proklyate-muzykanta-kalinina-n-d-5960910/
Сверхъестественное. Врезано в плоть,978-5-17-119821-3,Ваггонер Тим,"Двадцать два года назад Сэм и Дин Винчестеры потеряли мать, которую погубила таинственная злая сила. Когда они выросли, отец рассказал им о демонах, которые таятся во тьме и бродят по проселочным дорогам Америки. А еще он рассказал им о том, как с ними бороться… Cообщения о появлении адской собаки и расчлененных трупах приводят братьев Винчестеров в город Бреннан, штат Огайо. Поимка клыкастого монстра оборачивается кошмарными открытиями. Следы ведут от безумных ученых и новейших достижений биотехнологии к алхимикам прошлых веков, преданиям о ходячих трупах и древней зловещей силе.",https://book24.ru/product/sverkhestestvennoe-vrezano-v-plot-5929280/
Мертвая зона,978-5-17-137253-8,Кинг Стивен,"""Мертвая зона"" — легендарный роман, с которого началось знакомство отечественного читателя со Стивеном Кингом! Столкновение на льду обернулось для Джона Смита сотрясением мозга. С тех пор его неизменно преследуют страшные видения. А еще после катастрофы он приобрел сверхъестественные способности, превосходящие дар любого ясновидящего.",https://book24.ru/product/mertvaya-zona-5951766/
Лицо из зеркального коридора,978-5-17-136017-7,Романова Марьяна Михайловна,"Тихое провинциальное кладбище. Почерневшие от времени покосившиеся кресты, заросшие крапивой могилы, поблекшие от дождей остатки венков, вечный покой, нарушаемый только криком растрепанных ворон. Но это – днем. Ночью – это территория Смерти. Здесь по таинственному слову открываются двери в иные мрачные миры. И горе тому, кто попытается проникнуть в кошмарную тайну жителей потустороннего мира, захочет войти в контакт с умершими людьми, проникнуть в леденящий душу мир призрачных теней…",https://book24.ru/product/litso-iz-zerkalnogo-koridora-5936384/
"Голова, полная призраков",978-5-17-132584-8,Тремблей Пол Дж.,"15 лет назад. Жизнь семьи Барретт рушится, когда они узнают о диагнозе своей четырнадцатилетней дочери Марджори. У девочки все признаки острой шизофрении, и, к отчаянию родителей, врачи не в силах остановить ее безумие. Тогда Барретты обращаются к священнику, который предлагает провести обряд экзорцизма, веря в то, что в Марджори вселился демон. А чтобы покрыть бесконечные медицинские расходы, родители девочки соглашаются на участие в реалити-шоу... Наше время. Младшая сестра Марджори дает интервью известной писательнице, вспоминая события, которые произошли, когда ей было восемь лет. Ее воспоминания сильно отличаются от того, что транслировалось по телевидению. На поверхность начинают всплывать давно похороненные секреты, поднимающие непростые вопросы о памяти и реальности, науке и религии, а также о самой природе зла.",https://book24.ru/product/golova-polnaya-prizrakov-5934016/
Темная вода,978-5-00131-047-1,Кент Х.,"Ирландия, XIX век. В большие города уже пришла индустриальная эра, а обитатели деревенской глубинки, как и тысячу лет назад, верят в сверхъестественное. Когда у Норы Лихи скоропостижно умирают еще нестарый муж и молодая дочь, а четырехлетний внук теряет способность ходить и разговаривать, женщина понимает, что стала жертвой фэйри, или ""добрых соседей"", как их боязливо-уважительно называют жители долины. Против этих существ бессильны и лекарь, и священник - фэйри сами выбирают, кому помогать, а кому вредить.  Нора обращается к знахарке Нэнс Роух, которая, по слухам, знается с ""добрыми соседями"": ей ведома сила трав, воды и огня, она сумеет прогнать подменыша и вернуть бабушке здорового внука…  В своей второй книге автор всемирного бестселлера ""Вкус дыма"" Ханна Кент снова обращается к реальным историческим событиям - ""Темная вода"" написана на материалах судебного процесса в ирландском графстве Керри в 1826 году.",https://book24.ru/product/temnaya-voda-5945971/
Страшные истории. Не оставайся один в темноте…,978-5-17-135634-7,Аракелян Карина,"Карина Аракелян, самый мистический блогер Ютуба, представляет книгу, в которой собраны ее самые страшные истории. Все истории рассказывают в первую очередь о том, что страх делает с человеком — лишает воли, разума, а иногда и жизни… Проклятые вещи, существа из потустороннего мира, одержимые мистическими силами люди, ужасы и крики встретятся тебе на каждой странице. Эта книга переосмысливает Стивена Кинга и городские страшилки о «черном-черном городе», заново открывает новые грани страха. Ты думаешь, что гулять по заброшенному зданию — это интересно и весело? Но твои плечи начнет сжимать костлявая рука и плоть будут пронзать холодные иглы страха.  Ты думаешь, что волшебная вещь принесет счастье своему владельцу? Но его слова путаются, переходят в крик и волчий вой, глаза наливаются кровью, он бормочет как сумасшедший, скаля зубы, и хочет принести тебя в жертву своему маленькому идолу!  Ты думаешь, что пережить встречу с потусторонним миром было бы прикольно? Спроси у тех, кто пропал без вести, сошел с ума или превратился в кровавое месиво… В этой книге мистический блогер Карина Аракелян собрала самые страшные истории, которые произошли с ней самой, ее семьей и ее подписчиками. Тьма коснулась их, и Карина говорит их голосом. Тебе необязательно подвергать себя опасности в реальной жизни, чтобы утолить свой интерес, достаточно прочесть книгу. А Карина расскажет о том, как можно распознать потенциально чудовищные ситуации, как подчинить себе страх и жить дальше.",https://book24.ru/product/strashnye-istorii-ne-ostavaysya-odin-v-temnote-5950988/
Зов Ктулху,978-5-17-135718-4,Лавкрафт Говард Филлипс,"Лучшие произведения Лавкрафта. Они бесконечно разнообразны и многогранны. Одни относятся к классическому ""черному неоромантизму"", другие — к ""викторианской"" литературе ужасов. Одни представляют собой попытки научной фантастики, другие относятся к чистой мистике. Но в каждом из них живет гений писателя, подарившего нам лишь на шаг отстоящий от реальности причудливый мир ""богов-демонов"" — Подводного Ктулху и безликого Азатота, таинственного Шуб-Ниггурата и великого Йог-Сотота.",https://book24.ru/product/zov-ktulkhu-5934671/
Раны. Земля монстров,978-5-17-120882-0,Баллингруд Нейтан,"Это истории о монстрах, истории о поисках иных измерений, шокирующие и необычные, странные и откровенно жуткие. Это полное собрание рассказов Нейтана Баллингруда, творчество которого сравнивают как с работами Клайва Баркера, так и Реймонда Карвера. Здесь полярники находят расселину, ведущую в мир, достойный воображения Лавкрафта, бармен находит у себя на работе забытый клиентом телефон и тем самым превращает свою жизнь в настоящий кошмар, в обыкновенном городке открывается проход в ад, а вампиры, мертвецы и демоны проводят ярмарку с самыми неприятными последствиями для простых смертных. Здесь строители сталкиваются с оборотнем, мальчик хочет заключить договор с вампиром, и любой контакт с непознанным и страшным приводит к самым неожиданным последствиям. Парадоксальные и непредсказуемые, зловещие и потрясающие своим психологизмом  — все это истории Нейтана Баллингруда, одного из самых талантливых и необычных писателей, работающих сейчас в жанре хоррора.",https://book24.ru/product/rany-zemlya-monstrov-5927721/
Записки из Зазеркалья,978-5-517-02656-9,Чертанов М.,"Он толстый, робкий, пьющий, запутавшийся в жизни мечтатель. Пытаясь что-то изменить, он покупает старое зеркало и постепенно становится другим человеком. Но и действительность вокруг него начинает меняться.",https://book24.ru/product/zapiski-iz-zazerkalya-5871146/
Обломки клана,978-5-17-134167-1,"Шапочкин Александр Игоревич, Широков Алексей Викторович","Есть время разрушать, а есть — собирать обломки. Особенно если это осколки одного из древнейших кланов. Антон Бажов, может, и хотел бы быть обычным чародеем, но судьба то и дело подкидывает ему следы прошлого. Это его наследство, его дар и проклятие. Ведь Антону теперь предстоит собирать обломки великого клана. И, казалось бы, шестнадцатилетнему парню эта ноша может быть не по силам, но кто сказал, что Бажовы совсем исчезли? И Бажовы всегда платят свои долги. И горе тем, кто поверит, что зеленоглазые бестии действительно сгинули.",https://book24.ru/product/oblomki-klana-5905114/
