title,ISBN,author,description,link
Зов Ктулху,978-5-17-135798-6,Лавкрафт Говард Филлипс,"Говард Филлипс Лавкрафт стал первым писателем, объединившим в своих произведениях жанры ужасов, мистики и научной фантастики. Его уникальный стиль изложения и оригинальные идеи повлияли не только на целую плеяду современных авторов, таких как Стивен Кинг и Джордж Мартин, но и на культуру ХХ века в целом – кинематограф, искусство.  ""Мифы Ктулху"", неотъемлемая часть лавкрафтовских ужасов, выделились в отдельный жанр литературы. В этой вымышленной вселенной, населенной  древними божествами, а порой и героями, царит особая атмосфера и происходит вечная борьба между Светом и Тьмой.   В данный сборник вошли такие знаменитые рассказы как ""Зов Ктулху"", ""Дагон"", ""Шепчущий во тьме"", ""Данвичский ужас"", которые помогут читателям познакомиться с мистическим миром Лавкрафта и понять его мифологию.  Издание органично дополняют иллюстрации Анатолия Кудрявцева.",https://book24.ru/product/zov-ktulkhu-5928666/
Клатбище домашних жывотных,978-5-17-118359-2,Кинг Стивен,"Роман, который сам Кинг, считая ""слишком страшным"", долго не хотел отдавать в печать, но только за первый год было продано 657 000 экземпляров! Также роман лег в основу одноименного фильма Мэри Ламберт (где Кинг, кстати, сыграл небольшую роль). Казалось бы, семейство Крид — это настоящее воплощение ""американской мечты"": отец — преуспевающий врач, красавица мать, прелестные дети. Для полной идиллии им не хватает лишь большого старинного дома, куда они вскоре и переезжают.  Но идиллия вдруг стала превращаться в кошмар. Потому что в окружающих их новое жилище вековых лесах скрывается НЕЧТО, более ужасное, чем сама смерть и… более могущественное.",https://book24.ru/product/klatbishche-domashnikh-zhyvotnykh-5632815/
Монстролог. Все жуткие истории,978-5-17-136191-4,Рик Янси,"Легендарная серия ужасов Рика Янси – это смесь Стивена Кинга, Лавкрафта и Мэри Шелли.  В новый сборник вошли 4 романа Рика Янси: «Монстролог», «Проклятие Вендиго», «Кровавый остров» и «Ступени, ведущие в бездну». Мрачный цикл готических триллеров, пропитанный атмосферой викторианской эпохи. Главные герои охотятся на монстров, изучая их пугающую природу.  Несмотря на сложные отношения наставника доктора Уортропа и ученика Уилла, им удается найти общий язык и противостоять темным силам, постепенно раскрывая все более страшные тайны... Таинственный монстролог доктор Уортроп и его ученик, сирота Уилл Генри, охотятся на чудовищ, разгадывают тайны, терзающие человечество, и приближаются к ответу на самые важные вопросы — что же такое настоящий монстр? Кого считать чудовищем? И зачем инфернальные создания приходят в наш мир? Кем мы были до встречи с ними и кем станем после?..",https://book24.ru/product/monstrolog-vse-zhutkie-istorii-5933974/
Ночные кошмары и фантастические видения,978-5-17-104472-5,Кинг Стивен,"Неверный поворот на дороге приводит супружескую пару в городок под названием Рок-н-ролльные Небеса — и внезапно поездка оборачивается сущим адом… Бывший заключенный по кусочкам собирает карту местонахождения зарытого клада — но за сокровища ему придется заплатить слишком высокую цену… Писатель меняется местами со своим персонажем — и оказывается заточен в прошлом… Стивен Кинг возьмет вас в путешествие в свой мир, мир, где ночные кошмары становятся реальностью и так легко утратить спокойный сон…",https://book24.ru/product/nochnye-koshmary-i-fantasticheskie-videniya-1617775/
Вьюрки,978-5-17-132708-8,Бобылева Дарья Леонидовна,"Скрыться на время от безумия внешнего мира среди уютной зелени — мечта, сладкий сон… кошмар! Что, если ты НИКОГДА не сможешь покинуть свою дачу? Связи нет, дорога упирается в лес, соседи ведут себя странно, и лето — чертово лето! — никак не кончается... Роман вошел в лонг-лист премий ""Большая книга"", ""Ясная Поляна"", ""Интерпресскон"" и получил премии ""Новые горизонты"" и ""Мастера ужасов"".",https://book24.ru/product/vyurki-5868309/
Люди зимы,978-5-699-96996-8,Макмахон Дженнифер,"Об авторе     Дженнифер Макмахон — автор бестселлеров с мировым именем, признанный мастер психологической прозы с элементами мистики и хоррора. Ее книги переведены более чем на 10 языков мира и не раз становились бестселлерами по версии New York Times.     Жанр: психологический роман-хоррор; мистический триллер.        Особенности     Это самый известный роман Дженнифер Макмахон. Написанный в лучших традициях Стивена Кинга, создающий атмосферу фильмов Альфреда Хичкока, он придется по вкусу всем любителям пощекотать себе нервы.        О книге     Загадочная, запутанная и леденящая душу история о женщине, обладающей тайными знаниями и решившей воскресить из мертвых свою трагически погибшую дочь. Но события обернулись кошмаром не только для тех, кто стал свидетелем древнего ритуала, но и для тех, кто поселился в этом доме спустя десятилетия. Напряженное повествование, сочетание детективных, психологических. приключенческих и мистических мотивов делают роман одним из самых ярких американских бестселлеров жанра в этом десятилетии. 1908 год  В результате несчастного случая Сара и Мартин теряют дочь. Но Сара готова на все, чтобы вернуть ребенка. Она прибегает к загадочному ритуалу, которому еще в детстве ее научила возлюбленная отца, индианка. По слухам, та умела говорить с Людьми зимы – усопшими. Отчаявшаяся Сара решает испытать этот метод.   Наши дни  Вернувшись домой после долгого отсутствия, Рути обнаруживает, что ее мать бесследно исчезла. Вместе с младшей сестрой она отправляется на поиски, и они приводят ее в подземные пещеры, где обитает таинственная Герти – маленькая девочка, которая, как поговаривают местные жители, много лет назад восстала из мертвых...",https://book24.ru/product/lyudi-zimy-1589118/
11/22/63,978-5-17-078901-6,Кинг Стивен,"Этот роман безоговорочно признают лучшей книгой Стивена Кинга и миллионы фанатов писателя, и серьезные литературные критики.  …Убийство президента Кеннеди стало самым трагическим событием американской истории ХХ века. Тайна его до сих пор не раскрыта. Но что, если случится чудо? Если появится возможность отправиться в прошлое и предотвратить катастрофу? Это предстоит выяснить обычному учителю из маленького городка Джейку Эппингу, получившему доступ к временному порталу. Его цель - спасти Кеннеди. Но какова будет цена спасения?",https://book24.ru/product/11-22-63-186135/
Призраки Джейн Лоуренс,978-5-00195-714-0,Кейтлин Старлинг,"Умная и практичная Джейн решилась на брак по расчету, чтобы сохранить независимость и положение в обществе послевоенной Англии. Ее избранник — хирург Августин Лоуренс — согласился с одним условием: Джейн никогда не останется в Линдридж-холле, фамильном поместье за городом. Однако в ночь после свадьбы непроглядный ливень заставляет их укрыться в этом жутком полузаброшенном особняке. Августин меняется на глазах, в поместье творится что-то странное, и вскоре Джейн уже не может отличить реальность от кошмара. Для кого эта книга Для поклонников романов ""Мексиканская готика"" Сильвии Морено-Гарсиа, ""Призраки дома на холме"" Ширли Джексон, ""Анна в кроваво-алом"" Кендари Блейк и ""Горький апельсин"" Клэр Фуллер. Для любителей готических хорроров с таинственной устрашающей атмосферой.",https://book24.ru/product/prizraki-dzheyn-lourens-6629394/
Дом Холлоу,978-5-17-146604-6,Сазерленд Кристал,"- Бестселлер The New York Times и мгновенный инди-бестселлер. - Финалист международной премии International Thriller Writer Award - 2022. - Роман представляет собой необычное сочетание жанров: тёмное фэнтези, современная мистическая сказка и YA-роман про подростков. - По атмосфере напоминает фильм «Солнцестояние» и мрачные ретеллинги. Три сестры, Ирис, Виви и Грейс, удивительно красивы. Их волосы белые, а глаза черные. Они очень изменились после того, как ещё совсем девочками загадочно исчезли прямо из-под надзора родителей. А спустя месяц вернулись невредимыми и навсегда изменившимися. Сёстры Холлоу выросли, но ещё не осознали, какую страшную опасность несут для окружающих. Когда пропадает Грейс, старшая из сестёр, Ирис и Виви решают отыскать сестру и раскрыть тайну их загадочного перерождения. И она окажется гораздо опаснее, чем они рассчитывали. Много лет назад три сестры Холлоу пропали прямо из-под надзора родителей. Спустя месяц они появились в том же месте целыми и невредимыми. Но с того момента что-то изменилось. Их темные волосы стали пепельно-белыми, глаза потемнели, а аппетит стал просто нечеловеческим. Вдобавок между ключицами у каждой появился странный шрам в виде полумесяца. Никто не знает правду о том, что случилось, — даже они сами. Девочки Холлоу просто пытаются жить дальше. Но когда старшая сестра, Грейс, вновь пропадает, у них нет выбора: они должны посмотреть в глаза прошлому и раскрыть тайну своего исчезновения.",https://book24.ru/product/dom-khollou-6592843/
Носферату,978-5-04-167872-2,Хилл Джо,"Премия Лорда Рутвена — за роман о вампирах.   Премия Грэма Мастертона — за роман из США.   Премия Нокт — лучшая зарубежная книга.  Финалист Британской премии фэнтези — премия Августа Дерлета за лучший хоррор.  Номинант на премию «Локус» — роман фэнтези.  Финалист премии Брэма Стокера — лучший роман ужасов.  «Носферату» — это захватывающий мистический роман о сверхъестественном от мастера ужасов Джо Хилла, автора бестселлеров по версии New York Times «Коробка в форме сердца», «Черный телефон» и «Рога».  Виктория Маккуин обладает тайным даром находить вещи: потерянный браслет, пропавшую фотографию, ответы на вопросы, на которые нет ответов. На своем велосипеде «Роли Тафф Бернер» она добирается до шаткого крытого моста, который через мгновения переносит ее туда, куда ей нужно — будь то через Массачусетс или через всю страну.  Чарльз Талант Мэнкс умеет обращаться с детьми. Он любит катать их на своем «Роллс-Ройс Призрак» 1938 года выпуска с номерным знаком NOS4A2. В нем он может проскользнуть из повседневного мира на скрытые дороги, которые ведут в удивительную — и ужасающую — Страну Рождества.  В один прекрасный день Вик отправляется на поиски неприятностей — и находит Мэнкса. Это было целую жизнь назад. Теперь Вик, единственный ребенок, сбежавший от серийного похитителя, выросла и отчаянно хочет забыть о прошлом. Но Чарли Мэнкс никогда не переставал думать о Виктории Маккуин.   Он снова в пути. Он снова подобрал пассажира — собственного сына Вик.  «Шедевр ужасов». — Time  «Одна из лучших книг в жанре за последние годы». — Fantlab  «Прочитав эту книгу, вы никогда больше не будете воспринимать рождественские гимны по-старому». — Library Journal  «Новый взгляд на жанр фэнтези-хоррор». — The Sun Herold  «NOS4A2 — это блестящее исследование классических и современных монстров и темных фантазий, все смонтировано, перестроено и тюнинговано... Благодаря этому роману, захватывающему от начала до конца, Джо Хилл становится настоящим мастером своего дела». — Publishers Weekly   «К чтению строго рекомендуется». — Horrorzone В детстве у Виктории был велосипед, на котором она могла пересекать воображаемый мост и сразу попасть туда, куда хотела. Скоро Вик узнает, что она не единственная, у кого есть «магическая» вещь. Мэгги Ли, владелица оракула — фишек «Скраббл», рассказывает ей о Призраке на черном «Роллс-Ройсе» с номером NOS4A2-Носферату, который уже сотню лет похищает детей. Вик пытается выследить Призрака, но теряет велосипед и, повзрослев, думает, что все это было детской фантазией. Однако кошмар юности Вик вернулся — Призрак украл ее сына, и ей придется отправиться за ним в воображаемый мир психопата — Страну Рождества.",https://book24.ru/product/nosferatu-6569964/
Ничего личного,978-5-04-172157-2,Корсакова Татьяна,"Татьяна Корсакова пишет на границе смешения жанров сентиментального романа, детектива и мистики. Почитатели любовно-авантюрных историй знают ее под псевдонимом Алиса Корсак. В ее романах есть всё: настоящая дружба, первая любовь, мистика, нетривиальный сюжет.  Андрей женился на Кате назло деду, строго выполняя его условие: найти себе жену. Вот и нашел — первую встречную. Заплатил ей денег, как за честную сделку, и женился. В общем, ничего личного. Но чем дальше, тем больше интриговала его эта странная рыжая девушка. Какую тайну она скрывает? А ведь скрывает, совершенно точно. Почему согласилась на его сомнительное предложение?.. Пытаясь найти ответы на эти вопросы, Андрей и не заметил, как оказался в смертельной опасности.",https://book24.ru/product/nichego-lichnogo-6615946/
Усадьба ожившего мрака,978-5-04-168418-1,Корсакова Татьяна,"Татьяна Корсакова пишет на границе смешения жанров сентиментального романа, детектива и мистики. Почитатели любовно-авантюрных историй знают ее под псевдонимом Алиса Корсак. В ее романах есть всё: настоящая дружба, первая любовь, мистика, нетривиальный сюжет.  Они объединились, чтобы уничтожить упыря-экспериментатора Отто фон Клейста, обосновавшегося в старинной усадьбе Гремучий ручей. Их всего несколько человек, да еще жуткий трехголовый пес, порождение мрака и верный слуга девочки Танюшки. Она — потомок сверхлюдей, и потому вампир фон Клейст похитил ее. Этой маленькой фройляйн предназначена настолько ужасная миссия, что ни ее друзья, ни красавица-актриса и подпольщица Стелла, ни командир партизанского отряда Головин не пожалеют своих жизней, чтобы спасти Танюшку из плена фон Клейста. Но под силу ли людям бороться с не-человеком?",https://book24.ru/product/usadba-ozhivshego-mraka-6532037/
Книги крови,978-5-17-117246-6,Баркер Клайв,"""Каждый человек – это книга крови. Мы все алые, когда открыты"". Здесь мертвые рассказывают свои истории, вырезая их на теле живых. Здесь бродят чудовищные гиганты, состоящие из людей, в нью-йоркском метро скрываются страшные тайны, оживают древние монстры, а грань между страхом и наслаждением тонка как никогда. Перед вами первые три тома легендарных ""Книг крови"" Клайва Баркера. Они впервые издаются на русском языке под одной обложкой и с предисловием автора. Эти рассказы стали классикой не только хоррора, но и мировой литературы. Кровавые и поэтичные, зловещие и провокационные, они радикально изменили жанр ужасов и до сих пор являются непревзойденными образцами по-настоящему страшных и мрачных историй.",https://book24.ru/product/knigi-krovi-5695853/
