title,ISBN,author,description,link
Раскрытая,978-5-373-06785-0,"Каст Ф., Каст К.","Побежденная, но не уничтоженная Ауроксом, бывшая Верховная жрица Дома Ночи, бессмертная Неферет, с помощью Тьмы собирает силы, чтобы обрести привычный человеческий облик. В этом ей помогают воспоминания о прежней жизни, в которых Неферет полностью раскрывается, являя себе самой и миру свою истинную сущность...Синие и Красные недолетки по-прежнему вынуждены жить в школе, что грозит гибелью каждому из них...Одиннадцатый том серии-бестселлера «Дом Ночи»..",https://book24.ru/product/raskrytaya-6302293/
Город пустых. Побег из дома странных детей,978-5-9910-3024-3,Риггз Р.,"Город Пустых. Побег из Дома странных детей Руины большого города… Неведомая опасность, таящаяся среди разрушенных домов… Здесь оказались Джейкоб и его друзья – обитатели дома странных детей. Каждый из них наделен удивительными способностями, и все они хотят только одного – снять страшное заклятье с наставницы мисс Сапса. Враги, беспощадные монстры с пустыми глазами, неотступно преследуют героев. Джейкоб даже вообразить не мог, какие ловушки им приготовили. Он готов любой ценой спасти мисс Сапса и свою возлюбленную Эмму. Почему же Эмма сама просит его уйти? Как Джейкоб может слышать приближение Пустых? Откуда у него дар понимать монстров и повелевать ими? Издание проиллюстрировано уникальными старинными фотографиями. ..",https://book24.ru/product/gorod-pustykh-pobeg-iz-doma-strannykh-detey-6306642/
Темный соперник: роман / Джойс Б. (Центрполиграф),978-5-227-02560-9,Джойс Б.,"Под покровом ночи Элли Монро исцеляла людей и оберегала их от сил зла. Но однажды явился сияющий золотом Магистр Черный Ройр, чтобы защитить ее саму. Эта встреча разожгла огонь в сердцах Элли и Ройса. Очень скоро демоны уничтожили Магистра на глазах у Элли. Отважная целительница прошла сквозь время и пространство в надежде спасти возлюбленного, но средневековый мир оказался не столь дружелюбен, как предполагала Элли.",https://book24.ru/product/temnyy-sopernik-roman-dzhoys-b-tsentrpoligraf-6277023/
Мистические рассказы,978-5-00189-667-8,Петров Евгений Петрович,"В мире много всего непознанного, мистического или просто странного… Многие слышали про параллельные миры и о всевозможных существах из не нашего мира. Лешие и домовые, телепортация и телекинез – мало ли еще чего встречается в нашей жизни. Зачастую все странности или происходят в определенных местах или просто связаны с конкретными людьми. Они есть, и они реальны… Кто сможет все это объяснить? И нужно ли вообще что-то объяснять? Вот в этом-то и вопрос…",https://book24.ru/product/misticheskie-rasskazy-6138388/
Избранные небом. Фантастический роман,978-5-9573-2727-1,Шепс А.,"Фантастический роман ИЗБРАННЫЕ НЕБОМ Александр Шепс начал писать в выпускном классе школы и закончил лишь через девять лет. За это время произошло множество событий - и мистических, и трагических, - которые нашли отражение в сюжете. Прототипами некоторых героев являются реальные люди, друзья Александра, - многие из них по сей день отмечают, что события, описанные в романе, удивительным образом продолжают случаться в их реальной жизни. Борьба добра и зла, в самом центре которой оказались главные герои, продолжается с незапамятных времен, и это напряжение дает импульс к развитию всего человечества. Им не предоставили выбора, но поставили задачу - спасти мир. Только суперспособностей и фантастических доспехов оказалось недостаточно, ведь сражаться пришлось не только с приспешниками дьявола, но и самими собой. С какими испытаниями столкнулись Избранные небом и какой ценой досталось человечеству мирное спокойствие?",https://book24.ru/product/izbrannye-nebom-fantasticheskiy-roman-6298606/
Сочельник с привидениями,978-5-9603-0497-9,Джером К. Дж.,"Сборник странных, необычных и смешных рассказов Д. К. Джерома «Сочельник с привидениями» (оригинальное английское название « Истории, рассказанные после ужина») впервые был опубликован в 1891 г. и с тех пор неоднократно переиздавался. Иллюстрации к нему в данном издании выполнены английским художником Кеннетом Мэтмсоном Скипингом, который согласился сделать серию рисунков для этих рассказов после оглушительного успеха повести «Трос в лодке».",https://book24.ru/product/sochelnik-s-privideniyami-6142864/
Дракула,978-5-86218-580-5,Стокер Брэм,"Ни одна книга в европейской литературе последних веков не может даже приблизиться по популярности к роману Брэма (Абрахама) Стокера (1847-1912) ""Дракула"" (1897), главный герой которого вырвался далеко за рамки не только самого романа, но и литературы в целом, и превратился в один из символов минувшего столетия и, даже шире, - всей современности. На основе европейских преданий и легенд, оккультизма и эзотерики викторианской эпохи Стокеру, продолжателю ""готической"" линии М. Шелли и Ш. Ле Фаню, Р.-Л. Стивенсона и О. Уайльда, удалось создать свой необычайно красивый неоготический мир, простирающийся от средних веков до наших дней, от загадочной Трансильвании до уютного Лондона. А главное - предложить человечеству нового мифического героя. Героя на все времена. Как ни странно, при наличии несчетного числа перепечаток этот роман до сих пор не был должным образом опубликован по-русски. Его перевод выверен по новейшим критическим изданиям, восстановлены пропуски, более тщательно переданы особенности авторской речи, исправлены ошибки. Весьма представителен раздел ""Дополнения"" настоящего издания. Прежде всего это рассказ Стокера ""Гость Дракулы"" - либо глава, не вошедшая в роман, либо самостоятельное произведение, пользовавшееся в свое время не меньшей популярностью. Получить рельефную картину того, как современниками был принят ""Дракула"", поможет подборка многочисленных откликов. Основную часть раздела составляет обширный корпус исторических текстов: поэма австрийского мейстерзингера конца XV века Михаэля Бехайма ""Дракул-воевода"" (перевод В. Б. Микушевича), фрагменты ""Записок о достопамятных деяниях"" Папы римского Пия II, хроника ""Об одном злом тиране, прозванном Дракула-воевода"" Варфоломея Готана, фрагменты ""Славяно-сербских хроник"" Дж. Бранковича и др. Читатель сможет познакомиться с прототипом Дракулы - ""злохитростным"" воеводой Владом Цепешем, затмившим злодействами деяния Нерона, Диоклетиана и Ирода. Его наводящие ужас происки детально описаны современниками, в том числе знавшими жестокосердного воеводу лично. Большую ценность представляет глубокая статья ведущих отечественных исследователей, М. П. Одесского и Т. А. Михайловой, освещающих все аспекты жизни и творчества Стокера, корневую систему, породившую его культового персонажа. Рекомендуется самому широкому кругу читателей.",https://book24.ru/product/drakula-6135608/
Песнь Кали,978-5-17-133084-2,Симмонс Дэн,"Калькутта. Древний город ученых, философов, музыкантов, художников и поэтов. Город таинственных историй и странных верований, сочетающий в себе божественную красоту и отвратительное уродство, высоту духа и нищету обитателей тесных ночлежек, тонкие благовония и смрад мертвечины. Журналист Роберт Лузак по заданию редакции отправляется в это знаменитое место, чтобы привезти в Америку рукопись поэта Даса, ученика легендарного Рабиндраната Тагора. Обычная командировка оборачивается чередой ужасающих происшествий…",https://book24.ru/product/pesn-kali-6131505/
Галерея последних портретов,978-5-04-094751-5,"Тимошенко Н., Обухова Л.","Если вы любите «Сверхъестественное» и «Секретные материалы» — эти книги для вас! Таинственная атмосфера, колдуны, некроманты и призраки готовы раскрыть свои тайны тем, кто не побоится проследить за опасными приключениями команды исследователей паранормального. Принимая участие в исследовании сверхъестественного, Саша не представляла, что однажды опасность будет угрожать ей самой. С некоторых пор за спиной девушки появилась тень, сводящая ее с ума, а среди старых книг Александра нашла альбом с портретами женщин ее рода, сделанными накануне их смерти. Неужели проклятье настигло Сашу, и даже друзья не смогут ей помочь?..",https://book24.ru/product/galereya-poslednikh-portretov-2709027/
Шоссе петля,978-5-6045794-0-4,Новгородов О.,"Олег Новгородов - современный мастер ""ужастика"", создатель собственных зловещих миров, автор завораживающих рассказов, от которых читатель, знающий толк в качественном хорроре, просто не сможет оторваться. Место действия - подмосковный район Опольцево (никогда не существовавший в указанном месте) и окрестности шоссе Петля. Герои рассказов и повести - обычные современные люди, попадающие в необычные, порой фантастические ситуации. Действие произведений Новгородова разворачиваются в нулевые годы и в наши дни.",https://book24.ru/product/shosse-petlya-6125053/
Самая страшная книга. Скелеты,978-5-17-109999-2,Кабир Максим Ахмадович,"Максим Кабир — писатель, поэт, анархист. Беззаветный фанат жанра ужасов и мистики. Человек, с рассказами которого знакомы ВСЕ поклонники хоррора. И роман, который сравнивают с творчеством Кинга, Литтла, Лаймона — причем зачастую не в пользу зарубежных мэтров. Тихий шахтерский городок где-то в российской глубинке. Канун Нового года. Размеренная жизнь захолустья, где все идет своим чередом по заведенному порядку. Периодически здесь пропадают люди, а из дверного глазка пустой квартиры на вас смотрит то, что не должно существовать. Со зловещим скрипом открываются двери здешних шкафов, выпуская на свободу орды припрятанных там скелетов.  И вместе с памятью о неимоверной боли — в мир приходит невыразимое Зло.",https://book24.ru/product/samaya-strashnaya-kniga-skelety-2689602/
Остров Смертушкин,978-5-17-090886-8,Романова М.,"В книге ""Остров Смертушкин"" присутствуют атмосфера безоглядного ужаса, напряженности, и необъяснимого страха перед внешними силами, неведомыми нам. Смерть здесь — возбуждающее чудо и странность. Принято считать, что с помощью леденящих кровь историй читатель обретает нечто вроде катарсиса — очищение от страхов и рефлексий, может, хотя бы отчасти, отыскать причину своих угрюмых грез и мрачных видений. Да, в этом романе есть страх, но это страх-загадка, страх-ожидание, страх-предвкушение, страх-интерес, и потому он не воспринимается, как угроза нашему собственному существованию. Ведь любые жуткие образы — это, в конечном счете, яркий плод вашего воображения, дорогой читатель!",https://book24.ru/product/ostrov-smertushkin-2451567/
Рыбак,978-5-17-106414-3,Лэнган Джон,"Голландский ручей — прекрасное место для рыбалки, живописный лесной уголок вдали от бесконечной суеты современной цивилизации. С ним связаны причудливые легенды о таинственном Рыбаке и о чудовищах, которых он ловил.  Когда сюда приезжают Эйб и Дэн, два вдовца, потерявшие все самое дорогое в жизни, эти слухи кажутся им лишь очередной байкой, но постепенно рассказ о страшных событиях, которые случились в городе поблизости около века назад, о Рыбаке, монстрах и мертвецах вовлекают героев в историю мрачнее любого омута.  Друзья еще не знают, что местные воды гораздо глубже, чем кажутся, и ведут в пространства, неподвластные человеку; что древние тайны не умерли до сих пор; что ад всегда рядом, а тем, кто отчаялся, вскоре выпадет шанс встретиться со всем, что они потеряли. Вот только цена за эту встречу будет непомерной.",https://book24.ru/product/rybak-2690407/
Заброшенная шахта,978-5-04-092814-9,Варго А.,"На околице глухого заброшенного селения есть древняя шахта, в которой по преданьям, дремлет могущественная потусторонняя сила. В деревне всего один жилой дом и в нем влачат полунищее существование старуха с внучкой. Девочка погибает под колесами  автомобиля. У старухи помутился разум, и она   спускается в шахту с любимой внучкиной куклой. Там, в темном сыром подземелье в игрушку вселяется сила, призванная отомстить водителю-убийце и всей его семье. И  кукла, словно бы случайно, объявляется в доме мужчины, который был за рулем в тот роковой день…",https://book24.ru/product/zabroshennaya-shakhta-2061933/
Самая страшная книга. Чертовы пальцы,978-5-17-105777-0,Тихонов Дмитрий Александрович,"Черт знает, сколько у черта пальцев. Может, десять, а может — все пятнадцать. Но еще больше у черта масок, и он меняет их постоянно, являясь смертным в самых диковинных обличьях, иногда обманчиво-прекрасных, иногда — чудовищных. В этой книге собраны полтора десятка историй, в которых нечистая сила предстает во всем своем жутком, леденящем кровь многообразии. Не сопротивляйтесь. Позвольте ""Чертовым пальцам"" перенести вас в мир, где ничто не является тем, чем кажется.",https://book24.ru/product/samaya-strashnaya-kniga-chertovy-paltsy-2459540/
Судные дни,978-5-17-107023-6,Нэвилл Адам,"Находясь на грани банкротства, режиссер Кайл Фриман получает предложение, от которого не может отказаться: за внушительный гонорар снять документальный фильм о давно забытой секте Храм Судных дней, почти все члены которой покончили жизнь самоубийством в 1975 году. Все просто: три локации, десять дней и несколько выживших, готовых рассказать историю Храма на камеру. Но чем дальше заходят съемки, тем более ужасные события начинают твориться вокруг съемочной группы: гибнут люди, странные видения преследуют самого режиссера, а на месте съемок он находит скелеты неведомых существ, проступающие из стен. Довольно скоро Кайл понимает, что некоторые тайны лучше не знать, а Храм Судных дней в своих оккультных поисках, кажется, наткнулся на что-то страшное, потустороннее, и оно теперь не остановится ни перед чем.",https://book24.ru/product/sudnye-dni-2308781/
Самая страшная книга. 13 монстров,978-5-17-106734-2,Парфенов М. (сост.),"Монстров не существует!  Это известно каждому, но это — ложь. Они есть. Чтобы это понять, кому-то достаточно просто заглянуть под кровать. Кому-то — посмотреть в зеркало. Монстров не существует?  Но ведь монстра можно встретить когда угодно и где угодно. Монстр — это серая фигура в потоках ливня. Это твари, завывающие в тусклых пещерах. Это нечто, обитающее в тоннелях метро, сибирской тайге и в соседней подворотне.  Монстры — чудовища из иного, потустороннего мира. Те, что прячутся под обложкой этой книги. Те, после знакомства с которыми вам останется лишь шептать, сбиваясь на плачь и стоны, в попытке убедить себя в том, что:  Монстров не существует... Монстров не существует... Монстров не существует...",https://book24.ru/product/samaya-strashnaya-kniga-13-monstrov-2268195/
